{
  "version": 2,
  "keyboard": "go60",
  "firmware_api_version": "1",
  "locale": "en-US",
  "uuid": "",
  "parent_uuid": "d1380eff-30da-480f-ad0d-6f068344c165",
  "unlisted": false,
  "date": 1753145284,
  "creator": "moosy",
  "title": "Factory Default Layout",
  "notes": "Factory default layout for Go60\n\nThis layout is designed as a low-friction layout for beginners, mostly avoiding the use of hold-taps and other timing-dependent behaviours. \n\nThe layout has 5 layers:\n- Layer 0 (Base Layer): The alphas and numbers and base symbols\n- Layer 1 (Keypad Layer): Layer optimized for number data entry\n- Layer 2 (SymbolNav Layer): Navigation keys and symbol keys accessible via chording. Please note to simplify navigation key combos with ctrl+shift, this layer has added shift and control on the bottom row of the right hand pinky columns\n- Layer 3 (Magic Layer): Access to Go60 control functions such as RGB and Bluetooth\n- Layer 4 (Factory Test Layer): This layer is not used for normal typing; it is only for switch testing\n\nTo switch to Layer 1 (Keypad Layer), you can hold down RH C6R4 to temporarily switch into Layer 1, or double tap to persistently switch into Layer 1. You can single tap RH C6R4 to get back to the Layer 0 (Base Layer).\nTo switch to Layer 2 (SymbolNav Layer), you can hold down LH T1 to temporarily switch into Layer 2, or double tap to persistently switch into Layer 2. You can single tap LH T1 to get back to the Layer 0 (Base Layer).\n\nThe Right Trackpad mouse movement is accelerated 3 times the normal speed in the SymbolNav Layer (i.e. with LH T1 held).",
  "tags": [
    "qwerty"
  ],
  "custom_defined_behaviors": "",
  "custom_devicetree": "",
  "config_parameters": [],
  "layout_parameters": {
    "cirque_touch_sensitivity": ""
  },
  "layer_names": [
    "Base",
    "Keypad",
    "SymbolNav",
    "Magic",
    "Factory"
  ],
  "layers": [
    [
      {
        "value": "&kp",
        "params": [
          {
            "value": "EQUAL"
          }
        ]
      },
      {
        "value": "&kp",
        "params": [
          {
            "value": "N1"
          }
        ]
      },
      {
        "value": "&kp",
        "params": [
          {
            "value": "N2"
          }
        ]
      },
      {
        "value": "&kp",
        "params": [
          {
            "value": "N3"
          }
        ]
      },
      {
        "value": "&kp",
        "params": [
          {
            "value": "N4"
          }
        ]
      },
      {
        "value": "&kp",
        "params": [
          {
            "value": "N5"
          }
        ]
      },
      {
        "value": "&kp",
        "params": [
          {
            "value": "N6"
          }
        ]
      },
      {
        "value": "&kp",
        "params": [
          {
            "value": "N7"
          }
        ]
      },
      {
        "value": "&kp",
        "params": [
          {
            "value": "N8"
          }
        ]
      },
      {
        "value": "&kp",
        "params": [
          {
            "value": "N9"
          }
        ]
      },
      {
        "value": "&kp",
        "params": [
          {
            "value": "N0"
          }
        ]
      },
      {
        "value": "&kp",
        "params": [
          {
            "value": "MINUS"
          }
        ]
      },
      {
        "value": "&kp",
        "params": [
          {
            "value": "TAB"
          }
        ]
      },
      {
        "value": "&kp",
        "params": [
          {
            "value": "Q"
          }
        ]
      },
      {
        "value": "&kp",
        "params": [
          {
            "value": "W"
          }
        ]
      },
      {
        "value": "&kp",
        "params": [
          {
            "value": "E"
          }
        ]
      },
      {
        "value": "&kp",
        "params": [
          {
            "value": "R"
          }
        ]
      },
      {
        "value": "&kp",
        "params": [
          {
            "value": "T"
          }
        ]
      },
      {
        "value": "&kp",
        "params": [
          {
            "value": "Y"
          }
        ]
      },
      {
        "value": "&kp",
        "params": [
          {
            "value": "U"
          }
        ]
      },
      {
        "value": "&kp",
        "params": [
          {
            "value": "I"
          }
        ]
      },
      {
        "value": "&kp",
        "params": [
          {
            "value": "O"
          }
        ]
      },
      {
        "value": "&kp",
        "params": [
          {
            "value": "P"
          }
        ]
      },
      {
        "value": "&kp",
        "params": [
          {
            "value": "BSLH"
          }
        ]
      },
      {
        "value": "&kp",
        "params": [
          {
            "value": "ESC"
          }
        ]
      },
      {
        "value": "&kp",
        "params": [
          {
            "value": "A"
          }
        ]
      },
      {
        "value": "&kp",
        "params": [
          {
            "value": "S"
          }
        ]
      },
      {
        "value": "&kp",
        "params": [
          {
            "value": "D"
          }
        ]
      },
      {
        "value": "&kp",
        "params": [
          {
            "value": "F"
          }
        ]
      },
      {
        "value": "&kp",
        "params": [
          {
            "value": "G"
          }
        ]
      },
      {
        "value": "&kp",
        "params": [
          {
            "value": "H"
          }
        ]
      },
      {
        "value": "&kp",
        "params": [
          {
            "value": "J"
          }
        ]
      },
      {
        "value": "&kp",
        "params": [
          {
            "value": "K"
          }
        ]
      },
      {
        "value": "&kp",
        "params": [
          {
            "value": "L"
          }
        ]
      },
      {
        "value": "&kp",
        "params": [
          {
            "value": "SEMI"
          }
        ]
      },
      {
        "value": "&kp",
        "params": [
          {
            "value": "SQT"
          }
        ]
      },
      {
        "value": "&magic"
      },
      {
        "value": "&kp",
        "params": [
          {
            "value": "Z"
          }
        ]
      },
      {
        "value": "&kp",
        "params": [
          {
            "value": "X"
          }
        ]
      },
      {
        "value": "&kp",
        "params": [
          {
            "value": "C"
          }
        ]
      },
      {
        "value": "&kp",
        "params": [
          {
            "value": "V"
          }
        ]
      },
      {
        "value": "&kp",
        "params": [
          {
            "value": "B"
          }
        ]
      },
      {
        "value": "&kp",
        "params": [
          {
            "value": "N"
          }
        ]
      },
      {
        "value": "&kp",
        "params": [
          {
            "value": "M"
          }
        ]
      },
      {
        "value": "&kp",
        "params": [
          {
            "value": "COMMA"
          }
        ]
      },
      {
        "value": "&kp",
        "params": [
          {
            "value": "DOT"
          }
        ]
      },
      {
        "value": "&kp",
        "params": [
          {
            "value": "FSLH"
          }
        ]
      },
      {
        "value": "&layer",
        "params": [
          {
            "value": 1
          }
        ]
      },
      {
        "value": "&kp",
        "params": [
          {
            "value": "GRAVE"
          }
        ]
      },
      {
        "value": "&kp",
        "params": [
          {
            "value": "DEL"
          }
        ]
      },
      {
        "value": "&kp",
        "params": [
          {
            "value": "BSPC"
          }
        ]
      },
      {
        "value": "&kp",
        "params": [
          {
            "value": "LGUI"
          }
        ]
      },
      {
        "value": "&kp",
        "params": [
          {
            "value": "LBKT"
          }
        ]
      },
      {
        "value": "&kp",
        "params": [
          {
            "value": "RBKT"
          }
        ]
      },
      {
        "value": "&layer",
        "params": [
          {
            "value": 2
          }
        ]
      },
      {
        "value": "&kp",
        "params": [
          {
            "value": "LSHFT"
          }
        ]
      },
      {
        "value": "&kp",
        "params": [
          {
            "value": "LCTRL"
          }
        ]
      },
      {
        "value": "&kp",
        "params": [
          {
            "value": "LALT"
          }
        ]
      },
      {
        "value": "&kp",
        "params": [
          {
            "value": "SPACE"
          }
        ]
      },
      {
        "value": "&mt",
        "params": [
          {
            "value": "RALT"
          },
          {
            "value": "RET"
          }
        ]
      }
    ],
    [
      {
        "value": "&none"
      },
      {
        "value": "&kp",
        "params": [
          {
            "value": "F1"
          }
        ]
      },
      {
        "value": "&kp",
        "params": [
          {
            "value": "F2"
          }
        ]
      },
      {
        "value": "&kp",
        "params": [
          {
            "value": "F3"
          }
        ]
      },
      {
        "value": "&kp",
        "params": [
          {
            "value": "F4"
          }
        ]
      },
      {
        "value": "&kp",
        "params": [
          {
            "value": "F5"
          }
        ]
      },
      {
        "value": "&kp",
        "params": [
          {
            "value": "F6"
          }
        ]
      },
      {
        "value": "&kp",
        "params": [
          {